{
  "requirement_id": "ENV-02",
  "commit": "d9846dd83389562841beea040061e56d1ff95508",
  "target": "x86_64-unknown-linux-gnu-wsl-fixtures",
  "command": [
    "wsl",
    "--exec",
    "bash",
    "/mnt/c/naja/scripts/dev/test-setup.sh"
  ],
  "tool_versions": {
    "node": "v24.11.0",
    "powershell": "7.6.4",
    "cargo": "cargo 1.97.1 (c980f4866 2026-06-30)",
    "rustc": "rustc 1.97.1 (8bab26f4f 2026-07-14)",
    "git": "git version 2.51.0.windows.1"
  },
  "exit_code": 0,
  "result": "passed",
  "timestamp": "2026-10-24T13:15:08.7620587+00:00",
  "log_path": "reports/checks/seed-setup-shell-fixtures.log",
  "log_sha256": "15f3349479a9132c6cf726cae726fb7c2835da609f663d3269264ff0697c669f",
  "limitations": [
    "This check covers only the command and target recorded here; requirement completion requires its full acceptance criteria.",
    "Logs sanitize local workspace and user paths. No claim of a clean-room host, full HATCH acceptance or human productivity follows."
  ]
}
